[
  {
    "id_paciente": "PAC-201",
    "campos": {
      "neoplasia_ativa": {
        "valor": false,
        "status": "negado",
        "evidencia": "Hx de Ca de tireoide operado em 2015, sem evidência de doença desde então",
        "confianca": "media",
        "evidencia_verificada": true,
        "problemas": []
      },
      "gestacao": {
        "valor": null,
        "status": "nao_mencionado",
        "evidencia": null,
        "confianca": "alta",
        "evidencia_verificada": true,
        "problemas": []
      },
      "uso_metformina": {
        "valor": true,
        "status": "afirmado",
        "evidencia": "Em uso de MTF 850mg 12/12h",
        "confianca": "alta",
        "evidencia_verificada": true,
        "problemas": []
      }
    },
    "diagnosticos_mencionados": [
      "diabetes mellitus tipo 2",
      "ca de tireoide"
    ],
    "observacoes_relevantes": "Adesão à dieta boa.",
    "evidencia_verificada": true,
    "modelo_llm": "ollama/qwen2.5:3b+regras-v1",
    "versao_prompt": "extrator_v2",
    "hash_texto": "6c4fa2d7b0092190003c5d85d137373a08f49669f7512229bc426e391b4ee010",
    "extraido_em": "2026-10-16T17:06:05"
  },
  {
    "id_paciente": "PAC-202",
    "campos": {
      "neoplasia_ativa": {
        "valor": null,
        "status": "nao_mencionado",
        "evidencia": null,
        "confianca": "alta",
        "evidencia_verificada": true,
        "problemas": []
      },
      "gestacao": {
        "valor": null,
        "status": "nao_mencionado",
        "evidencia": null,
        "confianca": "alta",
        "evidencia_verificada": true,
        "problemas": []
      },
      "uso_metformina": {
        "valor": true,
        "status": "afirmado",
        "evidencia": "MUC: metformina XR 1g à noite",
        "confianca": "alta",
        "evidencia_verificada": true,
        "problemas": []
      }
    },
    "diagnosticos_mencionados": [
      "diabetes mellitus tipo 2",
      "dislipidemia",
      "obesidade"
    ],
    "observacoes_relevantes": "Pai falecido de câncer de próstata.",
    "evidencia_verificada": true,
    "modelo_llm": "ollama/qwen2.5:3b+regras-v1",
    "versao_prompt": "extrator_v2",
    "hash_texto": "d3b5ca2779685a9f938aae0314fa67ef07d7049c2a3f11c493008589442d784e",
    "extraido_em": "2026-10-16T17:06:05"
  },
  {
    "id_paciente": "PAC-203",
    "campos": {
      "neoplasia_ativa": {
        "valor": null,
        "status": "nao_mencionado",
        "evidencia": null,
        "confianca": "alta",
        "evidencia_verificada": true,
        "problemas": []
      },
      "gestacao": {
        "valor": false,
        "status": "negado",
        "evidencia": "Beta-HCG negativo colhido na semana passada",
        "confianca": "media",
        "evidencia_verificada": true,
        "problemas": []
      },
      "uso_metformina": {
        "valor": true,
        "status": "afirmado",
        "evidencia": "MUC: metformina 850mg 2x/dia",
        "confianca": "media",
        "evidencia_verificada": true,
        "problemas": []
      }
    },
    "diagnosticos_mencionados": [
      "diabetes mellitus tipo 2",
      "hipertensão arterial",
      "obesidade"
    ],
    "observacoes_relevantes": "Possível gravidez a confirmar.",
    "evidencia_verificada": true,
    "modelo_llm": "ollama/qwen2.5:3b+regras-v1",
    "versao_prompt": "extrator_v2",
    "hash_texto": "2a669e21fc4f70c5982c29455b67a902d479f9043c74e16211e640f777862f0b",
    "extraido_em": "2026-10-16T17:06:05"
  },
  {
    "id_paciente": "PAC-204",
    "campos": {
      "neoplasia_ativa": {
        "valor": false,
        "status": "negado",
        "evidencia": "Nega neoplasias",
        "confianca": "media",
        "evidencia_verificada": true,
        "problemas": []
      },
      "gestacao": {
        "valor": null,
        "status": "nao_mencionado",
        "evidencia": null,
        "confianca": "alta",
        "evidencia_verificada": true,
        "problemas": []
      },
      "uso_metformina": {
        "valor": null,
        "status": "incerto",
        "evidencia": "Nunca usou metformina",
        "confianca": "baixa",
        "evidencia_verificada": true,
        "problemas": [
          "leituras divergentes: IA = não mencionado, regras = tem"
        ]
      }
    },
    "diagnosticos_mencionados": [
      "diabetes mellitus tipo 2",
      "hipertensão arterial sistêmica",
      "obesidade",
      "hipoglicemia autolimitada por meio de urina"
    ],
    "observacoes_relevantes": "Doença de Marfan e história familiar de partos cesáreos.",
    "evidencia_verificada": true,
    "modelo_llm": "ollama/qwen2.5:3b+regras-v1",
    "versao_prompt": "extrator_v2",
    "hash_texto": "3f978af75d3195132f5404cb4ba9c8cfb5bbf2903bf7b9b921bad87201d14313",
    "extraido_em": "2026-10-16T17:06:05"
  },
  {
    "id_paciente": "PAC-205",
    "campos": {
      "neoplasia_ativa": {
        "valor": null,
        "status": "nao_mencionado",
        "evidencia": null,
        "confianca": "alta",
        "evidencia_verificada": true,
        "problemas": []
      },
      "gestacao": {
        "valor": true,
        "status": "afirmado",
        "evidencia": "Gestante, 20 semanas",
        "confianca": "alta",
        "evidencia_verificada": true,
        "problemas": []
      },
      "uso_metformina": {
        "valor": null,
        "status": "incerto",
        "evidencia": "Nega uso de metformina",
        "confianca": "baixa",
        "evidencia_verificada": true,
        "problemas": [
          "leituras divergentes: IA = não mencionado, regras = tem"
        ]
      }
    },
    "diagnosticos_mencionados": [
      "diabetes mellitus tipo 2",
      "obesidade"
    ],
    "observacoes_relevantes": "Gestante de 20 semanas.",
    "evidencia_verificada": true,
    "modelo_llm": "ollama/qwen2.5:3b+regras-v1",
    "versao_prompt": "extrator_v2",
    "hash_texto": "56293896cd231c572ad01e88480200e5b161c409953f8fd55be0c760e9a39c1a",
    "extraido_em": "2026-10-16T17:06:05"
  },
  {
    "id_paciente": "PAC-206",
    "campos": {
      "neoplasia_ativa": {
        "valor": null,
        "status": "nao_mencionado",
        "evidencia": null,
        "confianca": "alta",
        "evidencia_verificada": true,
        "problemas": []
      },
      "gestacao": {
        "valor": null,
        "status": "nao_mencionado",
        "evidencia": null,
        "confianca": "alta",
        "evidencia_verificada": true,
        "problemas": []
      },
      "uso_metformina": {
        "valor": null,
        "status": "nao_mencionado",
        "evidencia": null,
        "confianca": "alta",
        "evidencia_verificada": true,
        "problemas": []
      }
    },
    "diagnosticos_mencionados": [
      "diabetes mellitus tipo 2",
      "dislipidemia",
      "obesidade"
    ],
    "observacoes_relevantes": "Retorno sem queixas.",
    "evidencia_verificada": true,
    "modelo_llm": "ollama/qwen2.5:3b+regras-v1",
    "versao_prompt": "extrator_v2",
    "hash_texto": "0583c68b322ade7ed65ae42d5f6cd18e40ecd8344ae2edfdae1a812bbe3009f9",
    "extraido_em": "2026-10-16T17:06:05"
  },
  {
    "id_paciente": "PAC-207",
    "campos": {
      "neoplasia_ativa": {
        "valor": null,
        "status": "nao_mencionado",
        "evidencia": null,
        "confianca": "alta",
        "evidencia_verificada": true,
        "problemas": []
      },
      "gestacao": {
        "valor": null,
        "status": "incerto",
        "evidencia": "Veio acompanhada do filho",
        "confianca": "baixa",
        "evidencia_verificada": true,
        "problemas": [
          "leituras divergentes: IA = incerto, regras = não mencionado"
        ]
      },
      "uso_metformina": {
        "valor": null,
        "status": "incerto",
        "evidencia": "Em uso de empagliflozina 25mg/dia",
        "confianca": "baixa",
        "evidencia_verificada": true,
        "problemas": [
          "IA disse que usa metformina, mas o trecho citado não fala de metformina"
        ]
      }
    },
    "diagnosticos_mencionados": [
      "diabetes mellitus tipo 2",
      "insuficiência renal crônica",
      "obesidade",
      "hiperglicemia"
    ],
    "observacoes_relevantes": "Possível gravidez a confirmar.",
    "evidencia_verificada": true,
    "modelo_llm": "ollama/qwen2.5:3b+regras-v1",
    "versao_prompt": "extrator_v2",
    "hash_texto": "f9a18b18104f916dd1ca6920006bc2c866b2ccc1dbebc4ce1edd28529d5b1167",
    "extraido_em": "2026-10-16T17:06:05"
  },
  {
    "id_paciente": "PAC-208",
    "campos": {
      "neoplasia_ativa": {
        "valor": null,
        "status": "incerto",
        "evidencia": "AF: irmã com neoplasia de ovário",
        "confianca": "baixa",
        "evidencia_verificada": true,
        "problemas": [
          "leituras divergentes: IA = incerto, regras = não mencionado"
        ]
      },
      "gestacao": {
        "valor": null,
        "status": "nao_mencionado",
        "evidencia": null,
        "confianca": "alta",
        "evidencia_verificada": true,
        "problemas": []
      },
      "uso_metformina": {
        "valor": null,
        "status": "nao_mencionado",
        "evidencia": null,
        "confianca": "alta",
        "evidencia_verificada": true,
        "problemas": []
      }
    },
    "diagnosticos_mencionados": [
      "diabetes mellitus tipo 2"
    ],
    "observacoes_relevantes": "Últimos exames indicam controle do diabetes.",
    "evidencia_verificada": true,
    "modelo_llm": "ollama/qwen2.5:3b+regras-v1",
    "versao_prompt": "extrator_v2",
    "hash_texto": "40adf7c269ebfaad3dedaecc220d10b971d5c2457a8caeb319a8f2c7e8d9ef7f",
    "extraido_em": "2026-10-16T17:06:05"
  },
  {
    "id_paciente": "PAC-209",
    "campos": {
      "neoplasia_ativa": {
        "valor": null,
        "status": "nao_mencionado",
        "evidencia": null,
        "confianca": "alta",
        "evidencia_verificada": true,
        "problemas": []
      },
      "gestacao": {
        "valor": null,